name,rate,image,glb_company_size,industry,review,salary,jobs,description,office_locations
Amazon,-0.7822518812814923,https://media.glassdoor.com/sql/6036/amazon-squarelogo-1552847650117.png,0.22887574262210608,Internet & Web Services,5.040185774024578,8.175362509969666,0.7639295292915298,"All Amazon teams and businesses, from Prime delivery to AWS, are guided by four key tenets: customer obsession rather than competitor focus, passion for invention, commitment to operational excellence, and long-term thinking.  

We are driven by the excitement of building technologies, inventing products, and providing services that transform the way our customers live their lives and run their businesses.",-0.04990123823667486
Deloitte,0.49877528210150573,https://media.glassdoor.com/sql/2763/deloitte-squareLogo-1674210308592.png,0.22887574262210608,Accounting & Tax,2.559358775881778,2.9536128527889947,2.2407142838794396,"Deloitte provides industry-leading audit and assurance, tax and legal, consulting, financial advisory, and risk advisory services to nearly 90% of the Fortune Global 500® and thousands of private companies. Our more than 412,000+ professionals deliver measurable and lasting results that help reinforce public trust in capital markets, enable clients to transform and thrive, and lead the way toward a stronger economy, a more equitable society and a sustainable world. Building on its 178-plus year history, Deloitte spans more than 150 countries and territories.


Deloitte US-India Offices is part of region within the Deloitte US organization, with offices across seven cities in India — Hyderabad, Mumbai, Delhi-NCR, Bengaluru, Kolkata, Pune and Chennai.",-0.12442573435967245
McDonald's,-1.6362699902034923,https://media.glassdoor.com/sql/432/mcdonald-s-squareLogo-1696368009989.png,0.22887574262210608,Restaurants & Cafes,3.265488374849376,0.8151820408007188,8.315036481995747,"McDonald’s is proud to be one of the most recognized brands in the world, with restaurants in over 100 countries and billions of customers served each year.  As the global leader in the food service industry, we have a legacy of innovation and hard work that continues to drive us. Today, we are growing with velocity and are focused on modernizing our experiences, not to make a different McDonald’s but to build a better McDonald’s. About 80% of the restaurants are run by franchisees or affiliates.",-0.26331229531616795
Target,-1.6362699902034923,https://media.glassdoor.com/sql/194/target-squarelogo-1473787305116.png,0.22887574262210608,General Merchandise & Superstores,1.656387740033832,1.5353598594806634,0.5595945318013787,"As a Fortune 50 company with more than 400,000 team members worldwide, Target is an iconic brand and one of America's leading retailers. Working at Target means the opportunity to help all families discover the joy of everyday life. Caring for our communities is woven into who we are, and we invest in the places we collectively live, work and play. We prioritize relationships, fuel and develop talent by creating growth opportunities, and succeed as one Target team. At our core, our purpose is ingrained in who we are, what we value, and how we work. It's how we care, grow, and win together. ",-0.2531498640266683
Accenture,0.07176622764050578,https://media.glassdoor.com/sql/4138/accenture-squarelogo-1603988625135.png,0.22887574262210608,Business Consulting,4.180957279705598,0.502061250070308,2.723687914310706,"Accenture is a global professional services company with leading capabilities in digital, cloud and security. Combining unmatched experience and specialized skills across more than 40 industries, we offer Strategy and Consulting, Interactive, Technology and Operations services — all powered by the world’s largest network of Advanced Technology and Intelligent Operations centers. Our 624,000 people deliver on the promise of technology and human ingenuity every day, serving clients in more than 120 countries. We embrace the power of change to create value and shared success for our clients, people, shareholders, partners and communities. Visit us at www.accenture.com.",-0.1447505969386718
IBM,0.07176622764050578,https://media.glassdoor.com/sql/354/ibm-squareLogo-1680100245029.png,0.22887574262210608,Information Technology Support Services,2.571856644890054,0.8557035548952424,0.1509245368210767,"IBM works to design, advance, and scale the technologies that define each era. Restlessly reinventing since 1911, we are one of the largest technology, consulting and research companies in the world.  IBMers are agents of change – in this team, you’ll become a part of a historic, prestigious, and global community in which you’ll be respected, and your talents will have a real impact. 

Join our team of experts and thrive in a collaborative and friendly environment where you can bring your whole self at work. Use your skills to empower clients and partners to create something that is bigger than what any one of us could produce alone.

Come and let’s create together!",-0.1447505969386718
Tata Consultancy Services,-0.3552428268204942,https://media.glassdoor.com/sql/13461/tata-consultancy-services-squareLogo-1634801936555.png,0.22887574262210608,Software Development,3.3810936631759296,0.8962250689897662,-0.27632136702196636,"Tata Consultancy Services is an IT services, consulting and business solutions organization that has been partnering with many of the world’s largest businesses in their transformation journeys for over 50 years. TCS offers a consulting-led, cognitive powered, integrated portfolio of business, technology and engineering services and solutions. This is delivered through its unique Location Independent Agile™ delivery model, recognized as a benchmark of excellence in software development.

A part of the Tata group, India's largest multinational business group, TCS has over 528,000 of the world’s best-trained consultants in 46 countries. The company generated consolidated revenues of US $22.2 billion in the fiscal year ended March 31, 2021 and is listed on the BSE (formerly Bombay Stock Exchange) and the NSE (National Stock Exchange) in India. TCS' proactive stance on climate change and award-winning work with communities across the world have earned it a place in leading sustainability indices such as the MSCI Global Sustainability Index and the FTSE4Good Emerging Index. For more information, visit www.tcs.com",-0.137975642745672
Cognizant Technology Solutions,-0.3552428268204942,https://media.glassdoor.com/sql/8014/cognizant-technology-solutions-squareLogo-1651131366751.png,0.22887574262210608,Information Technology Support Services,2.2500365179269455,1.1301447185354259,-0.24845750372785483,"Cognizant (NASDAQ-100: CTSH) is one of the world's leading professional services companies, transforming clients'​ business, operating and technology models for the digital era. Our unique industry-based, consultative approach helps clients envision, build and run more innovative and efficient businesses. Headquartered in the U.S., Cognizant is ranked 208 on the Fortune 500 and is consistently listed among the most admired companies in the world. Learn how Cognizant helps clients lead with digital at www.cognizant.com. To apply for open positions, visit https://careers.cognizant.com",-0.16507545951767114
Starbucks,-1.2092609357424924,https://media.glassdoor.com/sql/2202/starbucks-squarelogo.png,0.22887574262210608,Restaurants & Cafes,1.293949538793826,0.7359808996159678,1.8227563344677669,"By bringing people together over coffee, Starbucks has become one of the world’s best-known and best-loved companies. We purchase, roast and serve award-winning coffee. We also offer Italian-style espresso beverages, cold blended beverages, delicious food, premium teas and selected compact discs through our retail stores. Working at Starbucks is a lot like working with your friends. When you work here, you’re not an “employee” – we call ourselves “partners” because we believe in shared common goals and mutual success. We’re dedicated to serving ethically sourced coffee, caring for the environment and giving back to the communities where we do business.
",-0.23621247854416882
EY,0.07176622764050578,https://media.glassdoor.com/sql/2784/ey-squareLogo-1689166016078.png,0.22887574262210608,Accounting & Tax,1.5689026569758995,0.7046688205429267,0.29953180772300475,"At EY, you will work with entrepreneurs, the biggest companies and entire countries to solve their most pressing challenges. We promise you an exceptional experience that is yours to build — using our opportunities, scale, technology, learning, and diverse and inclusive culture.

And what you do here matters, guided by our purpose of building a better working world — for our people, for our clients and for our communities. We help digital pioneers fight data piracy, guide governments through cash flow crises, unlock new medical treatments with data analytics, and pursue high-quality audits to build trust in financial markets and business. 

With over 400,000 people in more than 150 countries, we’re one of the world’s leading professional services organizations, with four integrated service lines: Assurance, Consulting, Strategy and Transactions, and Tax. Our global reach, skills and ability to learn from different perspectives help us create positive change on a massive scale.
",-0.2192750930616694
The Home Depot,-0.3552428268204942,https://media.glassdoor.com/sql/655/the-home-depot-squarelogo-1608140361711.png,0.22887574262210608,Home Furniture & Housewares Stores,0.6440603503634705,0.9938450802174825,-0.2670334125905958,"The Home Depot, the world’s largest home improvement specialty retailer, values and rewards dedicated, knowledgeable, and experienced professionals.

We operate over 2,300 retail stores in all 50 states, the District of Columbia, Puerto Rico, the U.S. Virgin Islands, Guam, Canada, and Mexico. All of our associates have one thing in mind — helping our customers build and improve their homes. 

Join The Home Depot team today and see for yourself why we are consistently ranked as a top Fortune 500 company.",8.046169022398063
PwC,0.07176622764050578,https://media.glassdoor.com/sql/8450/pwc-squareLogo-1688999699825.png,0.22887574262210608,Accounting & Tax,1.5907739277403827,0.39891557782970216,1.5441177015266518,"Our people are powered by technology to turn today’s ideas into tomorrow’s solutions.  Learn more about how you can help organizations meet the challenges and opportunities of the US marketplace in the areas of audit, tax, consulting and products and technology.

We connect people with diverse backgrounds and skillsets to solve important problems together—for our clients, our communities and for the world at large.",-0.016026467271675955
Apple,1.3527933910235057,https://media.glassdoor.com/sql/1138/apple-squarelogo-1595530154096.png,0.22887574262210608,Computer Hardware Development,0.4066008392062252,1.8337455541767018,0.07662090137011271,"We’re a diverse collective of thinkers and doers, continually reimagining what’s possible to help us all do what we love in new ways. And the same innovation that goes into our products also applies to our practices — strengthening our commitment to leave the world better than we found it. This is where your work can make a difference in people’s lives. Including your own.  

Apple is an equal opportunity employer that is committed to inclusion and diversity. Visit apple.com/careers to learn more.",-0.18540032209667048
US Army,-0.3552428268204942,https://media.glassdoor.com/sql/41322/us-army-squarelogo.png,0.22887574262210608,National Agencies,0.5034593240203648,0.8906994079768766,-0.2948972758847073,"The US Department of the Army has its marching orders. One of the three military departments (along with the Air Force and Navy) of the US Department of Defense, the Army provides ground-based military forces to deter and fight wars and protect the security of the US. The army has more than 675,000 soldiers, including active duty soldiers (nearly 75%) and reservists (Army National Guard and Army Reserves). Army personnel are deployed in about 80 countries. The Army operates about 40 forts throughout the US and has bases in Africa, Europe, Japan, the Middle East, and South Korea.",-0.12781321145617233
Wells Fargo,-1.2092609357424924,https://media.glassdoor.com/sql/8876/wells-fargo-squarelogo-1569533783558.png,0.22887574262210608,Banking & Lending,0.6440603503634705,0.6273095663624723,-0.22059364043374333,"Wells Fargo & Company (NYSE: WFC) is a leading financial services company that has approximately $1.9 trillion in assets, proudly serves one in three U.S. households and more than 10% of small businesses in the U.S.  Wells Fargo is No. 47 on Fortune’s 2023 rankings of America’s largest corporations. In the communities we serve, the company focuses its social impact on building a sustainable, inclusive future for all by supporting housing affordability, small business growth, financial health, and a low-carbon economy. 

We ranked #2 on the 2023 LinkedIn Top Companies list – and #1 among financial services companies – as the best workplace “to grow your career” in the U.S. For more information, visit wellsfargo.com | Twitter: @wellsfargo ",-0.1820128450001706
Oracle,-0.3552428268204942,https://media.glassdoor.com/sql/1737/oracle-squarelogo-1570718316042.png,0.22887574262210608,Enterprise Software & Network Solutions,0.7440433024296791,1.0583111253678612,-0.09985023282592682,"Oracle is the cloud leader for global business. Our technologies are transforming the world and no matter how complex, they have one thing in common: making our shared future better. Realize your potential as part of a company that’s innovating solutions to global challenges that affect billions of lives. Visit oracle.com/careers.",-0.12103825726317256
Bank of America,0.49877528210150573,https://media.glassdoor.com/sql/8874/bank-of-america-squareLogo-1696271923493.png,0.22887574262210608,Banking & Lending,0.38160510118967306,0.45417218795859815,-0.2948972758847073,"Bank of America is one of the world’s leading financial institutions, serving individual consumers, small and middle-market businesses and large corporations with a full range of banking, investing, asset management and other financial and risk management products and services. 

We provide unmatched convenience in the United States, serving approximately 68 million consumer and small business clients with approximately 3,900 retail financial centers, approximately 15,000 ATMs and award-winning digital banking with approximately 56 million verified digital users. 

We are a global leader in wealth management, corporate and investment banking and trading across a broad range of asset classes, serving corporations, governments, institutions and individuals around the world. Bank of America offers industry-leading support to approximately 3 million small business households through a suite of innovative, easy-to-use online products and services. We serve clients through operations across the United States, its territories and more than 35 countries. 

By driving Responsible Growth, we deliver for teammates, clients, and the communities we serve.  Being a Great Place to Work for our teammates is core to our approach. Our goal continues to be a company where people want to work today and build a career.  We provide employees with access to leading benefits and programs that help teammates be well—physically, emotionally and financially.  And we provide a variety of resources to help teammates grow in their roles and build new skills. 

Our diversity—in thought, style, gender, sexual orientation, gender identity, race, ethnicity, culture, religion, age, ability, military status and experience—makes us stronger and is essential for us to serve our clients, fulfill our purpose and drive Responsible Growth.",-0.18540032209667048
AT&T,-1.2092609357424924,https://media.glassdoor.com/sql/613/at-and-t-squareLogo-1677605813073.png,0.22887574262210608,Telecommunications Services,0.39410297019794915,0.42654388289415013,-0.19272977713963182,"Looking for a new way to connect? You’re in the right place. We are in the business of connection – to our customers, our communities, and each other.  We are invested in building strong networks, future facing technology solutions, and career opportunities that have a global impact.

We want to give you 4 reasons why you should join #LifeAtATT.

1.	Whether you’re pursuing a career in sales, technology, or something else entirely, you’re ready to connect to something bigger. 
2.	We’ve got opportunities all over the globe to do what you love.
3.	Living our values – standing for equality, pursuing excellence, and thinking big – is right in your wheelhouse.
4.	You like great benefits.

Ready? It’s all waiting for you at att.jobs, and while you’re at it check out #LifeAtATT to get the latest on how we’re living, working, and playing.

We hope to connect with you soon!  ",-0.18540032209667048
Lowe's Home Improvement,-1.6362699902034923,https://media.glassdoor.com/sql/415/lowe-s-home-improvement-squareLogo-1677875740566.png,-4.079662135596275,Home Furniture & Housewares Stores,0.4190987082145013,0.4523303009543016,-0.24845750372785483,"Lowe’s Companies, Inc. (NYSE: LOW) is a FORTUNE® 35 home improvement company serving approximately 19 million customers a week in the United States. With the fiscal year 2022 sales of nearly $97 billion, Lowe’s and its related businesses operate or service more than 1,700 home improvement and hardware stores and employ over 300,000 associates. Based in Mooresville, N.C., Lowe’s supports the communities it serves through programs focused on creating safe, affordable housing and helping to develop the next generation of skilled trade experts. For more information, visit Lowes.com.",-0.26331229531616795
Qualcomm,0.49877528210150573,https://media.glassdoor.com/sql/640/qualcomm-squareLogo-1662140255236.png,0.22887574262210608,Computer Hardware Development,-0.5588595416831011,3.673790671468939,-0.31505213700078133,Qualcomm is a company of inventors designing the cutting-edge wireless technologies the world runs on.,-0.15491302822817146
UPS,-1.6362699902034923,https://media.glassdoor.com/sql/3012/ups-squareLogo-1633526374628.png,0.22887574262210608,Shipping & Trucking,0.19413706606553205,0.3547102897265853,-0.24845750372785483,"Every day at UPS, our people are responsible for the movement of goods, funds and information in more than 200 countries and territories.

As UPS has evolved from a Seattle-based bike messenger company into a multi-billion-dollar global corporation, our team has held a singular focus—empowering commerce around the world. Today, UPS is the world's largest package delivery company and a leading global provider of specialized transportation and logistics services.

Whether we’re connecting with global giants or local mom and pop businesses, our people are at work improving distribution networks and managing supply chains—helping our customers to do what they do best. UPS makes the world work better.",-0.1820128450001706
KPMG,-0.3552428268204942,https://media.glassdoor.com/sql/2867/kpmg-squareLogo-1675929586261.png,0.22887574262210608,Business Consulting,1.0033740843514076,-0.09471013932176886,0.4574270330563033,"KPMG LLP, the U.S. audit, tax and advisory services firm, operates from more than 100 offices with more than 32,000 employees and partners throughout the U.S. Our purpose is to turn knowledge into value for the benefit of our clients, our people, and the capital markets.

KPMG delivers a globally consistent set of multidisciplinary services based on deep industry knowledge. Our industry focus helps KPMG professionals develop a rich understanding of clients' businesses and the insight, skills, and resources required to address industry-specific issues and opportunities.",-0.1786253679036707
Best Buy,-1.2092609357424924,https://media.glassdoor.com/sql/97/best-buy-squareLogo-1650652693751.png,0.22887574262210608,Consumer Electronics & Appliances Stores,0.28787108362760255,0.2386714084559037,-0.30418523031607786,"At Best Buy, our purpose is to enrich lives through technology. To achieve this, over 100,000 employees provide solutions to our customers in over 1,000 locations, online, and in their homes.
 
We’re a community of courageous change-makers, ambitious collaborators, and inspiring friends. Whether it’s working as a Geek Squad Agent, an in-store advisor, or in our corporate office, we offer each other support and prepare for what might come next.
 
We wake up every morning so we can do our part in shaping the future of a changing world. Together, we raise the bar for what’s possible and dream up new solutions to problems we’ve never encountered. We master innovative skills that we didn’t know were within grasp and turn everyday interactions into human connections built to last.
 
If change motivates you, if technology inspires you — we’re here for you. Tomorrow works here.™

http://jobs.bestbuy.com",-0.2429874327371686
Cisco Systems,2.2068114999455055,https://media.glassdoor.com/sql/1425/cisco-systems-squareLogo-1702924319691.png,0.22887574262210608,Enterprise Software & Network Solutions,0.14727005728449677,0.8999088429983593,-0.3695724295129262,"#WeAreCisco, where each person is unique. We bring our talents to work as a team each day, helping power an inclusive future for all. Here's how we do it. 

At Cisco, we embody transformation and help our customers excel in their digital worlds. Some may think we're ""old"" (38+ years strong!) and only about hardware, but we're also a software company, a security company, a blockchain company, and an AI/Machine Learning company. We even invented an intuitive network that adapts, predicts, learns, and protects. Our innovation never stops! 

Cisco values the perspectives and skillsets that arise from employees with diverse backgrounds. That's why Cisco is expanding the boundaries of discovering top talent by not only focusing on candidates with college degrees and experience but instead placing more emphasis on unlocking potential. 

As one of the leading forces in connecting the world, we understand our unique opportunity to bring communities together and create meaningful change for everyone, everywhere. That's why connecting starts within Cisco. Over 30,000 Cisconians participate in our Employee Resource Groups, called Inclusive Communities, where we network, learn to be informed allies, and help make a difference. 

Cisco didn't just build the Internet. We keep building it. And while our technology helps connect the unconnected, that's not where our edge comes from. It comes from our people—unique, innovative, and diverse. Be you, with us! ",-0.18540032209667048
Verizon,-0.3552428268204942,https://media.glassdoor.com/sql/89/verizon-squareLogo-1628778296366.png,0.22887574262210608,Telecommunications Services,0.1691413280489799,0.13920951022389091,-0.30985088251921383,"You want more out of a career. A place to share your ideas freely — even if they’re daring or different. Where the true you can shine through. A space to create and connect with people who truly care. And where there’s the flexibility to focus on the passions that matter most.

Our network is built by people like you. We’re a human network that reaches across the globe and works behind the scenes. We anticipate, lead, and believe that listening is where learning begins. In crisis and in celebration, we come together—lifting up our communities and striving to make an impact to move the world forward.

So, if you're fueled by purpose, and powered by persistence, explore a career with us. Here, you’ll discover the rigor it takes to make a difference and the fulfillment that comes with living the #NetworkLife.

www.verizon.com/careers",-0.19217527628967027
Intel Corporation,0.9257843365625038,https://media.glassdoor.com/sql/1519/intel-corporation-squarelogo-1599065494667.png,0.22887574262210608,Computer Hardware Development,0.0785317777389784,0.419176334876964,-0.14629000498277933,"Intel’s mission is to shape the future of technology to help create a better future for the entire world. By pushing forward in fields like AI, analytics and cloud-to-edge technology, Intel’s work is at the heart of countless innovations. From major breakthroughs like self-driving cars and rebuilding the coral reefs, to things that make everyday life better like blockbuster effects and improved shopping experiences — they’re all powered by Intel technology. With a career at Intel, you have the opportunity to help make the future more wonderful for everyone.

Join us.",-0.16168798242117124
Capgemini,-0.7822518812814923,https://media.glassdoor.com/sql/3803/capgemini-squareLogo-1688367853815.png,0.22887574262210608,Enterprise Software & Network Solutions,1.47204417216176,-0.14812486244636833,0.14163658238970622,"At Capgemini, we are driven by a shared purpose: Unleashing human energy through technology for an inclusive and sustainable future.

As a leading strategic partner to companies around the world, we have leveraged technology to enable business transformation for more than 50 years. We address the entire breadth of business needs, from strategy and design to managing operations. To do this, we draw on deep industry expertise and a command of the fast-evolving fields of cloud, data artificial intelligence, connectivity, software, digital engineering, and platforms.",-0.08377600920167376
