name,rate,image,glb_company_size,industry,review,salary,jobs,description,office_locations
HSBC,-0.3552428268204942,https://media.glassdoor.com/sql/3482/hsbc-holdings-squarelogo.png,0.22887574262210608,Banking & Lending,0.025415834453805106,-0.5643913254173849,-0.22059364043374333,"One of the world's largest banking groups by assets, HSBC Holdings owns subsidiaries throughout Europe, Hong Kong and the rest of the Asia/Pacific region, the Middle East and Africa, and the Americas. All told, the company has some 7,500 locations in more than 80 countries. Its activities include consumer and commercial banking, credit cards, private banking, investment banking, and leasing. Its North American operations comprise HSBC USA, HSBC Bank Canada, HSBC Bank Bermuda, and Grupo Financiero HSBC in Mexico.",-0.23959995564066872
Ulta Beauty,-1.6362699902034923,https://media.glassdoor.com/sql/9466/ulta-beauty-squarelogo-1438973561413.png,0.22887574262210608,Beauty & Personal Accessories Stores,-0.521365934658273,-0.37467696397484196,0.35525953431122775,"
ALERT: We are aware of a scam whereby imposters are posing as employees from Ulta Beauty and vendors to Ulta Beauty. Beware of anyone requesting financial or personal information.

At Ulta Beauty, we take pride in creating a best in class candidate experience. During the recruitment process, no recruiter or employee will request financial or personal information (Social Security Number, credit card, driver’s license or bank information, etc.) from you via text or email. If you are suspicious of a job posting or job-related email mentioning Ulta Beauty, let us know by contacting us at 630-410-4800 or email HRServiceCenter@ulta.com.

At Ulta Beauty (NASDAQ: ULTA), the possibilities are beautiful. Ulta Beauty is the largest U.S. beauty retailer and the premier beauty destination for cosmetics, fragrance, skin care products, hair care products and salon services. In 1990, the Company reinvented the beauty retail experience by offering a new way to shop for beauty – bringing together all things beauty, all in one place. Today, Ulta Beauty has grown to become the top national retailer offering the complete beauty experience.
 
Ulta Beauty brings possibilities to life through the power of beauty each and every day in our stores and online with more than 25,000 products from approximately 500 well-established and emerging beauty brands across all categories and price points, including Ulta Beauty’s own private label. Ulta Beauty also offers a full-service salon in every store featuring hair, skin, brow, and make-up services.",2.609268282515739
TD,0.07176622764050578,https://media.glassdoor.com/sql/3767/td-squarelogo-1593607213249.png,0.22887574262210608,Banking & Lending,-0.2620351527365445,-0.5220279243185646,-0.2948972758847073,"TD Bank, America's Most Convenient Bank, is one of the largest banks in the U.S., providing over 10.0 million customers with a full range of retail, small business and commercial banking products and services at more than 1,100 convenient locations throughout the Northeast, Mid-Atlantic, Metro D.C., the Carolinas and Florida. In addition, TD Auto Finance, a division of TD Bank, N.A., offers vehicle financing and dealer commercial services. TD Bank and its subsidiaries also offer customized private banking and wealth management services through TD Wealth®. TD Bank is headquartered in Cherry Hill, N.J.",-0.26331229531616795
Procter & Gamble,0.9257843365625038,https://media.glassdoor.com/sql/544/procter-and-gamble-squarelogo.png,0.22887574262210608,Consumer Product Manufacturing,-0.352644703046546,-0.512818489297082,-0.2670334125905958,"P&amp;G was founded over 175 years ago as a soap and candle company. Today, we’re the world’s largest consumer goods company and home to iconic, trusted brands, including Always®, Charmin®, Duracell®, Fairy®, Febreze®, Gillette®, Head &amp; Shoulders®, Oral B®, Pantene®, Pampers®, Tide®, and Vicks®.

The design, development, growth and success of these products—and many more—is thanks to the innovative and insightful minds of our people. From Day One, you’ll help make everyday life easier for our 5 billion customers through billion dollar brands. And as our customers are found around the globe, so too are our opportunities: wherever you are in the world, there will be a place for you with P&amp;G nearby.

We offer opportunities in approximately 70 countries and continually aim to attract, reward and advance the finest people in the world. As a ""build from within"" organization, we see 95% of our people start at an entry level and progress through the organization. Here, we want you to get your career off to a fast start. That's why we don't have any rotational development programs or gradual ramping-up periods: you’ll be able—and encouraged—to dive right in from day one.

Join us and help make life better through meaningful work that makes an impact from Day One.",-0.14813807403517168
ABC,0.49877528210150573,https://media.glassdoor.com/sql/130/abc-squarelogo.png,0.22887574262210608,Broadcast Media,-0.3838893755672362,-0.47229697520255826,-0.3964146178195869,"Some Desperate Housewives, a Modern Family, and a group of doctors schooled in Grey's Anatomy call this network home. ABC operates the #3 television network in the US (behind CBS and FOX), with more than 230 affiliates (including 10 corporate-owned stations). ABC also owns an 80% stake in ESPN, a leader in cable sports broadcasting with a stable of channels, including ESPN2, ESPN Classic, and ESPN News, as well as its flagship channel. (Publisher Hearst owns the remaining 20% of ESPN.) In addition, the company operates mass-market publisher Hyperion. ABC is the cornerstone of Disney-ABC Television Group, the TV division of parent Walt Disney.",-0.2463749098336685
Cerner,-1.6362699902034923,https://media.glassdoor.com/sql/1242/cerner-squareLogo-1654696960872.png,0.22887574262210608,Computer Hardware Development,-0.5619840089351701,-0.3765188509791385,-0.3927923155913524,"We are innovators. What will you create with us?
At Cerner, we innovate at the intersection of technology, health and care to transform how healthcare is delivered. For us, it’s more than just innovation for the sake of innovation, and transformation is about more than change. It’s about being a part of something bigger than yourself – about impacting the future and communities all over the world.
Our smarter solutions are setting a new trajectory for the way healthcare is delivered, through applications so advanced, physicians and providers don’t even have to think about them. Instead, they can focus on what truly matters – saving and improving patient lives. 
Cerner solutions are licensed at more than 27,500 in over 35 countries. No matter the size or location of the organization, our systems and services are helping to solve the world’s most complex healthcare solutions.
It’s a promise today for an even better tomorrow. Make the most of your best at Cerner.",-0.18540032209667048
VMware,2.2068114999455055,https://media.glassdoor.com/sql/12830/vmware-squarelogo-1605872987364.png,0.22887574262210608,Enterprise Software & Network Solutions,-0.5057435983979278,-0.38572828600062115,-0.3951143041991951,"VMware is a leading provider of multi-cloud services for all apps, enabling digital innovation with enterprise control.

With VMware Cross-Cloud™ services and our global ecosystem of partners, we deliver the smartest path to cloud, edge, and app modernization. Our technology also supports multi-cloud autonomy for developers and consistent operations for DevSecOps—while creating a more secure, frictionless experience for the distributed workforce.

As the trusted foundation to accelerate innovation, VMware preserves customer choice and protects against lock-in. Instead of tradeoffs and compromises, our software offers businesses the freedom and flexibility they need to build the future.",-0.11426330307017278
NVIDIA,3.0608296088675018,https://media.glassdoor.com/sql/7633/nvidia-squareLogo-1672943582283.png,0.22887574262210608,Computer Hardware Development,-0.715082904286552,0.4320695439070397,-0.23916954929648435,"Since its founding in 1993, NVIDIA (NASDAQ: NVDA) has been a pioneer in accelerated computing. The company’s invention of the GPU in 1999 sparked the growth of the PC gaming market, redefined computer graphics, ignited the era of modern AI and is fueling the creation of the metaverse. NVIDIA is now a full-stack computing company with data-center-scale offerings that are reshaping industry.",-0.19217527628967027
Insight Global,-0.3552428268204942,https://media.glassdoor.com/sql/152783/insight-global-squareLogo-1611942057614.png,-4.079662135596275,HR Consulting,-0.5151170001541349,-0.4520362181552964,-0.3776529498682185,"Insight Global isn’t just a staffing company. We’re a company that cares for others. It might sound lofty, but it's the idea that gets us up every day, determined to make it true. Insight Global is a company that people can anchor to in moments of triumph, struggle, and every time in between. Whoever you are and wherever you come from, you matter to us and we have your back. Whether it’s finding the right candidate for a job or seamlessly managing a project end to end, our conviction and commitment to our consultants and clients runs deep. With 60 field offices across the US and Canada, putting to work over 50,000 Consultants annually, we believe; together, anything is possible. ",-0.036351329850675296
Thomson Reuters,0.9257843365625038,https://media.glassdoor.com/sql/100303/thomson-reuters-squareLogo-1688475995493.png,0.22887574262210608,Enterprise Software & Network Solutions,-0.3870138428193052,-0.49439961925411663,-0.34133704804155984,"Thomson Reuters is a leading provider of business information services. Our products include highly specialized information-enabled software and tools for legal, tax, accounting and compliance professionals combined with the world’s most global news service – Reuters. For more information on Thomson Reuters, visit tr.com and for the latest world news, reuters.com.",-0.2125001388686696
Ford Motor Company,0.49877528210150573,https://media.glassdoor.com/sql/263/ford-motor-company-squareLogo-1685656516785.png,0.22887574262210608,Transportation Equipment Manufacturing,-0.45262765511275455,-0.42993357410373795,-0.18344182270826134,"OUR PURPOSE
We believe in the power of creating a world with fewer obstacles and limits, where people have the freedom to build a better life and pursue their dreams.
 
To shorten the distance between where you are and where you want to go.

To connect people down the road and over the horizon — to discover possibilities, and enjoy the thrill, adventure and pride of moving freely.

From day one, we've provided people with tools to help them move forward and upward.
We've innovated to expand their opportunities. And we've worked to earn their trust, every single day.
 
We honor our legacy as we build the future – a better world for generations to come. Because when everyone is free to move, and free to dream, we do what we do best: we change the world.

OUR HISTORY
Henry Ford transformed not only the automobile but working life and the role of transportation. Having played our part in everything from the birth of the middle class to the recent global pandemic, we serve the world with integrity and competence. The Blue Oval is one of the most recognized corporate symbols in history, continually striving to earn the trust of all stakeholders.

OUR CULTURE
Ford is a family company in more ways than one. The culture is anchored in shared beliefs and ideals, acting for the common good. As an organization, Ford believes everyone should have the freedom to move and pursue their dreams, and seeks to create a culture of belonging for every employee.






Ford Motor Company (NYSE: F) is a global company based in Dearborn, Michigan. The company designs, manufactures, markets and services a full line of Ford trucks, utility vehicles, and cars – increasingly including electrified versions – and Lincoln luxury vehicles; provides financial services through Ford Motor Credit Company; and is pursuing leadership positions in electrification; mobility solutions, including self-driving services; and connected vehicle services.  Ford employs approximately 186,000 people worldwide. For more information regarding Ford, its products and Ford Motor Credit Company, please visit corporate.ford.com.

Privacy Policy: https://www.ford.com/help/privacy/

For career opportunities, please visit https://corporate.ford.com/careers.html.",-0.1820128450001706
H E B,1.3527933910235057,https://media.glassdoor.com/sql/2824/h-e-b-squarelogo-1521485228314.png,0.22887574262210608,Grocery Stores,-0.5119925329020658,-0.3820445119920281,-0.20201773157100233,"H-E-B is one of the largest, independently owned food retailers in the nation operating over 375 stores throughout Texas and Mexico, with annual sales generating over $23 billion. Described by industry experts as a daring innovator and smart competitor, H-E-B has led the way with creative new concepts, outstanding service and a commitment to diversity in our workforce, workplace and marketplace. H-E-B offers a wealth of career opportunities to our 100,000+ Partners (employees), competitive compensation and benefits program and comprehensive training that lead to successful careers.",-0.26331229531616795
Concentrix,0.49877528210150573,https://media.glassdoor.com/sql/31549/concentrix-squareLogo-1695636773078.png,0.22887574262210608,Information Technology Support Services,0.19101259881346302,-0.5772845344474606,-0.27632136702196636,"We’re Concentrix + Webhelp and we Design, Build, and Run the future of CX.

We understand customers better than anyone else can. Within billions of data-points, our engineers find and harness the insight to craft experiences that touch hearts and move markets. We believe in creating experiences that go beyond Wow; combining human talent with artificial intelligence to design, build and run truly integrated customer journeys, at scale, across the entire enterprise. 

Whether you’re a small company with big ideas or a leading global brand, we’re not just your next-door neighbor, we’re everyone’s, everywhere. 

It doesn’t matter if your customer journey spans channels, technology, 
or even oceans – we’ve got you covered. 

We’re behind the scenes of the brands you rely on every day, So chances are, we’ve already met! 

Learn more: https://jobs.concentrix.com/global/en ",0.5327448223613063
Kforce,0.07176622764050578,https://media.glassdoor.com/sql/5441/kforce-squareLogo-1639416143264.png,0.22887574262210608,Business Consulting,-0.7775722493279323,0.2092012163871592,-0.3718015385764551,"Kforce is a solutions firm specializing in technology, finance and accounting, and professional staffing services. Our KNOWLEDGEforce® empowers industry-leading companies to achieve their digital transformation goals. We curate teams of technical experts who build solutions custom-tailored to each client’s needs. These scalable, flexible outcomes are shaped by deep market knowledge, thought leadership and our multi-industry expertise. 

Our integrated approach is rooted in 60 years of proven success deploying highly skilled professionals on a temporary and direct-hire basis. Each year, more than 25,000 talented experts work with a significant majority of the Fortune 500. Together, we deliver Great Results Through Strategic Partnership and Knowledge Sharing®.

A career at Kforce gives you the opportunity to experience, learn and grow. We believe trust and empowerment build the strongest teams. We help you achieve success with structured onboarding, training, mentorship and continuous development programs. You’ll have the ability to explore unique career path options that create opportunities for the future you envision for yourself. Join an award-winning firm that provides the tools, technology and support you need to achieve your greatest potential.",3.625511411465706
US Department of Veterans Affairs,-0.7822518812814923,https://media.glassdoor.com/sql/41429/us-department-of-veterans-affairs-squarelogo-1503799452898.png,0.22887574262210608,National Agencies,-0.5838552796996532,-0.3709931899662489,0.0208931747818897,"VA offers Veterans the largest, most technologically advanced, integrated health care system in the United States. We serve more than 9 million Veterans enrolled in the VA health system and operate more than 1,200 care sites, including 170 medical centers and more than 1,070 outpatient clinics, across all 50 states, the District of Columbia and U.S. territories. 

Currently, more than 322,000 full-time health care professionals and support staff work in interdisciplinary care teams to deliver patient services daily. VA’s patient population crosses a wide spectrum of individuals — from elderly World War II Veterans to younger heroes who served in operations Enduring Freedom and Iraqi Freedom. VA also serves a growing number of female Veterans, who currently account for 7% of the total Veteran population.",-0.18540032209667048
Intuit,2.2068114999455055,https://media.glassdoor.com/sql/2293/intuit-squareLogo-1661448829538.png,0.22887574262210608,Software Development,-0.5494861399268941,-0.3617837549447662,-0.22988159486511384,"Intuit is the global financial technology platform that powers prosperity for the people and communities we serve. With more than 100 million customers worldwide using TurboTax, Credit Karma, QuickBooks, and Mailchimp, we believe that everyone should have the opportunity to prosper.

Our strategy is to create an AI-driven expert platform that helps solve our customers’ most important financial challenges. By digitizing the financial services industry, we’re giving people the confidence they need to make the right decisions for themselves and their families. 

Working with a day-one entrepreneurial mindset, we’re always open to new perspectives and ideas. This helps us remain nimble, encourages experimentation and open collaboration, and results in a constant stream of game-changing innovations. 

Through our culture of inclusion and belonging, you can do meaningful work with a diverse community of people who share your values and support you in doing the best work of your life. Learn more about Intuit and our career opportunities at intuit.com/careers.",-0.20911266177216972
Thermo Fisher Scientific,-1.2092609357424924,https://media.glassdoor.com/sql/658/thermo-fisher-scientific-squareLogo-1622674704280.png,0.22887574262210608,Biotech & Pharmaceuticals,-0.5557350744310321,-0.4317754611080345,0.20665226340929974,"Our global team of more than 125,000 colleagues delivers an unrivaled combination of innovative technologies, purchasing convenience and pharmaceutical services through our industry-leading brands, including Thermo Scientific, Applied Biosystems, Invitrogen, Fisher Scientific, Unity Lab Services, Patheon and PPD. For more information, please visit www.thermofisher.com.",-0.15152555113167157
Freelancer,1.3527933910235057,https://media.glassdoor.com/sql/392261/freelancer-squarelogo-1503383966970.png,-5.464648238316664,HR Consulting,-0.3838893755672362,-0.485190184232634,-0.39464990647762654,"8 time Webby award winning Freelancer.com is the world's largest freelancing and crowdsourcing marketplace by total number of users and projects posted. 

Over 15 million registered users have posted over 7.5 million projects and contests to date in over 700 areas as diverse as website development, logo design, marketing, copywriting, astrophysics, aerospace engineering and manufacturing. 

Freelancer Limited is listed on the Australian Securities Exchange under the ticker ASX:FLN.",-0.2158876159651695
Optum,-0.7822518812814923,https://media.glassdoor.com/sql/2409113/optum-squareLogo-1689785571840.png,0.22887574262210608,Health Care Services & Hospitals,-0.5401127381706871,-0.38388639899632465,-0.09985023282592682,"UnitedHealth Group is a health care and well-being company that’s dedicated to improving the health outcomes of millions worldwide. We are comprised of two distinct and complementary businesses, UnitedHealthcare and Optum, working to build a better health system for all. Here, your contributions matter as they will help transform health care for years to come. Make an impact with a diverse team that shares your passion for helping others.

Caring. Connecting. Growing together. 

Being a part of UnitedHealth Group means working to improve health outcomes for everyone, including yourself. Here is how:

Caring. Your total health and well-being are important to us. Whatever matters most to you — we have resources to help you be your best at work and at home. The benefits range from free Peloton courses to financial counseling. 

Connecting. We recognize our collective power to make an impact across our communities because we believe the health of any society is measured by the overall health of its people. 

Growing together. UnitedHealth Group is full of inspiring career stories, and we offer a lifetime of opportunities. Discover all the ways you can learn, grow and develop.",-0.2429874327371686
RTX,-0.7822518812814923,https://media.glassdoor.com/sql/561/rtx-squareLogo-1697547260138.png,0.22887574262210608,Aerospace & Defense,-0.6338467557327575,-0.38020262498773155,-0.2670334125905958,"RTX is comprised of three market-leading businesses – Collins Aerospace, Pratt & Whitney and Raytheon – working as one to answer the biggest questions and solve the hardest problems in aerospace and defense.

At RTX, we're a diverse team of explorers united in our goal to push the boundaries of known science – and solve the world's most complex problems.

We design. We engineer. We code. We research. We patent. We test. We learn. We iterate. We manufacture. We produce.

We are advancing aviation, building smarter defense systems and creating innovations to take us deeper into space. Progress is not inevitable. It is initiated – by tirelessly asking the hard questions and finding answers.

Progress defines the future and defines us – because the progress we make matters.",-0.18540032209667048
CBRE,0.49877528210150573,https://media.glassdoor.com/sql/465818/cbre-squareLogo-1631711657814.png,0.22887574262210608,Real Estate,-0.5151170001541349,-0.43914300912522064,-0.14629000498277933,"CBRE is the world’s largest commercial real estate services and investment company, with the #1 global market position in leasing, property sales, outsourcing, property management and valuation. CBRE is also the largest commercial property developer in the United States, and has $129.1B of Assets Under Management within our Global Investors business. Our more than 100,000 employees serve clients in over 100 countries, including over 90% of the Fortune 100.",-0.18540032209667048
Labcorp,-1.2092609357424924,https://media.glassdoor.com/sql/1679/labcorp-squarelogo-1608085527142.png,0.22887574262210608,Health Care Services & Hospitals,-0.5713574106913772,-0.4151984780693657,-0.24845750372785483,"Labcorp is a leading global life sciences company with a mission to improve health and improve lives. Combining world-class diagnostic solutions with its drug development business, our cutting-edge technologies, unparalleled data, and growing menu of standard and highly-specialized tests not only inform and empower patients and providers but help medical, biotech, and pharmaceutical companies transform ideas into innovations. Labcorp’s more than 60,000 employees are pursuing critical advances in science and changing the delivery of healthcare while advancing essential vaccines, cancer-fighting breakthroughs, and life-changing treatments for rare diseases. ",-0.1413631198421719
