name,rate,image,glb_company_size,industry,review,salary,jobs,description,office_locations
US Navy,-0.7822518812814923,https://media.glassdoor.com/sql/41451/us-navy-squarelogo-1601323365030.png,-4.079662135596275,National Agencies,0.03791370346208118,0.18525668533130424,-0.39167776105958796,"America’s Navy is the most versatile branch of the military, forging defense on land, in the air, and at sea. With opportunities across the globe and a commitment to serve the greater good, the Navy offers a life of fulfillment, advancement, and innovation to every Sailor.",-0.18540032209667048
Meta,0.07176622764050578,https://media.glassdoor.com/sql/40772/meta-squareLogo-1636117276319.png,0.22887574262210608,Internet & Web Services,-0.34327130129033895,0.5444246511691283,-0.19272977713963182,"Meta builds technologies that help people connect, find communities, and grow businesses. When Facebook launched in 2004, it changed the way people connect. Apps like Messenger, Instagram and WhatsApp further empowered billions around the world. Now, Meta is moving beyond 2D screens toward immersive experiences like augmented and virtual reality to help build the next evolution in social technology. ",-0.19895023048267005
Citi,0.07176622764050578,https://media.glassdoor.com/sql/8843/citi-squareLogo-1686753614162.png,0.22887574262210608,Investment & Asset Management,0.1722657953010489,-0.037611642188576315,-0.1555779594141498,"Working at Citi is far more than just a job. A career with us means joining a family of more than 240,000 dedicated people from around the globe. At Citi, you’ll have the opportunity to grow your career, give back to your community and make a real impact.

Citi connects millions of people across hundreds of cities and countries every day through our unparalleled global network. With varying businesses and functions at each location, there are an abundance of opportunities beyond the work you’ll do with your team.

We are a dynamic, global organization fueled by talented individuals with diverse perspectives who work in a vast range of roles. Whatever your background, culture, role or experience, there is a place for you at Citi. 

Whether you’re at the start of your career or looking to discover your next adventure, your story begins here. At Citi, you’ll have the opportunity to expand your skills and make a difference at one of the world’s most global banks.

To find out more about the roles available in your region and apply, please visit www.jobs.citi.com",-0.1820128450001706
Dell Technologies,1.3527933910235057,https://media.glassdoor.com/sql/1327/dell-technologies-squarelogo-1702514279238.png,0.22887574262210608,Information Technology Support Services,0.21600833683001516,-0.1462829754420718,-0.37421640672861145,"We believe that each of us has the power to make an impact. That’s why we put our team members at the center of everything we do. If you’re looking for an opportunity to grow your career with some of the best minds and most advanced tech in the industry, we’re looking for you. Dell Technologies is a unique family of businesses that helps individuals and organizations transform how they work, live and play. Join us to build a future that works for everyone because Progress Takes All of Us.  ",-0.18540032209667048
Capital One,0.49877528210150573,https://media.glassdoor.com/sql/3736/capital-one-squareLogo-1667853695285.png,0.22887574262210608,Banking & Lending,-0.3713915065589601,-0.015508998137017914,-0.22988159486511384,"You know who you are and you’re good at it. You never settle for “good enough.” That’s why we want you at Capital One. We’re doing some bold, transformative things here. Like changing banking for good. What’s in it for you? A career surrounded by brilliant minds. People from different backgrounds, experiences and education levels. Coming together to create a sense of belonging. Supporting you where you are and where you want to be. And the chance to create real, impactful work that matters—without giving up your life or integrity to achieve it. That’s life at Capital One.",-0.16168798242117124
HCLTech,-1.2092609357424924,https://media.glassdoor.com/sql/553909/hcl-technologies-squareLogo-1664198027190.png,0.22887574262210608,Information Technology Support Services,0.47221465149967456,0.18157291132271117,-0.3054855439364697,"HCLTech is a global technology company, home to 221,000+ people across 60 countries, delivering industry-leading capabilities centered around digital, engineering, cloud and AI powered by a broad portfolio of technology services and products. We work with clients across all major verticals, providing industry solutions for Financial Services, Manufacturing, Life Sciences and Healthcare, Technology and Services, Telecom and Media, Retail and CPG, and Public Services.

Our purpose is to bring together the best of technology and our people to supercharge progress. We’re supercharging progress for everyone, everywhere – our clients, partners and their stakeholders, our people, communities, and the planet.

Part of the HCL group, HCLTech was listed on the stock exchanges in India at the turn of the millennium in December 1999. Since our inception, we have pioneered several industry mainstays and established leadership positions in all our chosen segments.

As a company, we are deeply focused on accelerating our ESG agenda. We are also creating technology-enabled sustainable solutions with and for our clients and partners. We embed ESG imperatives into every aspect of our business and ensure that the progress we supercharge is responsible, inclusive and beneficial to all our stakeholders in the long term. We have committed to achieving net zero by 2040.

We recognize the impact that a business like ours can deliver in elevating communities globally, and we continue to improve our efforts and take decisive actions that benefit the communities in which we work and live. Through the HCL Foundation, the CSR arm of HCLTech, we have invested more than $130 million in social development efforts serving communities throughout India across education, health, water, sanitation and hygiene, skill development and livelihoods, environment, and disaster risk reduction, response and management.

We’re powered by our people – a global, diverse, multi-generational talent - representing 161 nationalities whose unique spark, perspective and boundless passion drive our culture of proactive value creation and problem-solving.

Consolidated revenues as of 12 months ending September 2023 totaled $12.9 billion. To learn how we can supercharge progress for you, visit hcltech.com",-0.15152555113167157
Salesforce,0.9257843365625038,https://media.glassdoor.com/sql/11159/salesforce-com-squarelogo-1413910133565.png,0.22887574262210608,Enterprise Software & Network Solutions,-0.29640429250930367,-0.1352316534162926,-0.30418523031607786,"Salesforce is cloud-based CRM software. It makes it easier for companies to find more prospects, close more deals, and connect with customers in a whole new way, so they can provide them with amazing service at scale.

Salesforce brings together all your data, from any source. Customer 360, our complete suite of products, unites your sales, service, marketing, commerce, and IT teams with a single, shared view of customer information. With artificial intelligence integrated across all products, Salesforce helps everyone in your company work more productively and better deliver the personalized experiences customers love.",-0.0736135779121741
Nordstrom,-1.2092609357424924,https://media.glassdoor.com/sql/1704/nordstrom-squareLogo-1679960370211.png,0.22887574262210608,"Department, Clothing & Shoe Stores",-0.15580326616619788,-0.15365052345925792,-0.38731242247684383,"At Nordstrom, we empower our employees to set their sights high and blaze their own trails. This is a place where your success and growth are truly a result of your own efforts and achievements. 

Our teams are made up of motivated people who work hard to become leaders within the company, at all levels of the organization. These well-traveled paths show how hard work, loyalty, a competitive spirit and your unwavering commitment to the customer can take you and your career to new places.  

In addition to being a great place to have a career, we’re also committed to respecting the environment and supporting our communities. To learn more, check out NordstromCares.com.

Interested in joining the Nordstrom team?  

See some of our current opportunities under our Careers tab or visit careers.nordstrom.com to apply today.",5.488623814540646
Teleperformance,1.7798024454845038,https://media.glassdoor.com/sql/9779/teleperformance-squareLogo-1697744314989.png,0.22887574262210608,Telecommunications Services,0.922137935797613,-0.5201860373142682,-0.24845750372785483,"Be part of something bigger.

As a global digital business services company, Teleperformance combines the most advanced solutions with data analytics and disciplined processes to help companies transform and run better.  In the end, we just help organizations adapt to change and master the future. 

We deliver the most advanced, digitally powered business services to help the world’s best brands streamline their business in meaningful and sustainable ways.

With more than 410,000 inspired and passionate people speaking more than 300 languages, our global scale and local presence allow us to be a force of good in supporting our communities, our clients, and the environment. 

Our high-tech, high-touch approach blends the best of technology and empathy. We thrive in a diverse and inclusive culture that celebrates the differences and strengths of our people. The happiness, well-being, and safety of our employees remain our priority, and we are proud to be an Employer of Choice: 99% of our employees work in a certified Best Place to Work® or Great Place to Work® site.

The future of work is here. Are you ready to take a giant leap towards a bigger and brighter career? We’ll help you get there. Take your career to greater heights with Teleperformance.",-0.137975642745672
Goldman Sachs,-0.3552428268204942,https://media.glassdoor.com/sql/2800/goldman-sachs-squarelogo-1579121885039.png,0.22887574262210608,Investment & Asset Management,-0.30890216151757977,-0.09102636531317579,-0.37495944308312107,"The Goldman Sachs Group, Inc. is a leading global investment banking, securities and investment management firm that provides a wide range of financial services to a substantial and diversified client base that includes corporations, financial institutions, governments and high-net-worth individuals. Founded in 1869, the firm is headquartered in New York and maintains offices in all major financial centers around the world.",-0.18540032209667048
ADP,0.07176622764050578,https://media.glassdoor.com/sql/64/adp-squareLogo-1690899108128.png,0.22887574262210608,Enterprise Software & Network Solutions,-0.2589106854844755,-0.2696894047299395,-0.2670334125905958,"Consistently named one of the ‘Most Admired Companies’ by FORTUNE® Magazine, and recognized by DiversityInc® as one of the ‘Top 50 Companies for Diversity’, ADP works with more than 1,000,000 organizations across the globe to help their people work smarter, embrace new challenges, and unleash their talent. “Always Designing for People” means we’re creating platforms that will transform how great work gets done, so together we can unlock a world of opportunity.",-0.20911266177216972
Morgan Stanley,0.07176622764050578,https://media.glassdoor.com/sql/2282/morgan-stanley-squareLogo-1670774499083.png,0.22887574262210608,Investment & Asset Management,-0.29640429250930367,-0.212590907596747,-0.36177054779057494,"Morgan Stanley mobilizes capital to help governments, corporations, institutions and individuals around the world achieve their financial goals. For over 85 years, the firm’s reputation for using innovative thinking to solve complex problems has been well earned and rarely matched. A consistent industry leader throughout decades of dramatic change in modern finance, Morgan Stanley will continue to break new ground in advising, serving and providing new opportunities for its clients. 

Morgan Stanley is committed to maintaining the first-class service and high standard of excellence that have always defined the firm. At its foundation are five core values — putting clients first, doing the right thing, leading with exceptional ideas, committing to diversity and inclusion, and giving back — that guide its more than 80,000 employees in 1,200 offices across 41 countries.

Discover what makes Morgan Stanley such a great place to work by using the resources on this page to learn more about our people, our business, and our heritage.
",-0.029576375657675517
Comcast,-0.7822518812814923,https://media.glassdoor.com/sql/1280/comcast-squarelogo-1552675219892.png,0.22887574262210608,Telecommunications Services,-0.3682670393068911,-0.20522335957956087,-0.2948972758847073,"We connect people to the moments that matter most.  Here, you’ll collaborate with diverse and passionate people to help re-imagine industries, invent new technologies and create extraordinary experiences for our customers. 

At Comcast NBCUniversal, we are day-doers, adventurers, and visionaries, pioneering the future at the intersection of media and technology.  We reimagine industries, invent groundbreaking technology and create extraordinary experiences for millions every day. It’s the diverse talents of our people that have propelled us to a Fortune 50 global industry leader. Everyone here has a voice and it’s the diverse talents of our people that have propelled us forward as a leader in connected experiences. It’s what also drives us to make a positive impact and empower change within the communities we serve. 

We are looking for people that share our passion for innovation to join our team – ready to create their own path and connect the world to amazing moments and experiences.

Come create the future with us! Apply today: http://comcastcareers.com.",-0.17185041371067092
Boeing,0.07176622764050578,https://media.glassdoor.com/sql/102/boeing-squarelogo-1544719001985.png,0.22887574262210608,Aerospace & Defense,-0.3838893755672362,-0.16470184548503713,-0.24845750372785483,"The story of our company is woven together from thousands of individual stories of engineers and technicians. Scientists and thinkers. Innovators and dreamers. Equity, diversity and inclusion are crucial to our employees, our stakeholders, and our communities. These foundational principles are how we create the most innovative aerospace products and services in the world. After all, we go further together.

Boeing is an Equal Opportunity Employer. Employment decisions are made without regard to race, color, religion, national origin, gender, sexual orientation, gender identity, age, physical or mental disability, genetic factors, military/veteran status or other characteristics protected by law. ",-0.18540032209667048
State Farm,-1.2092609357424924,https://media.glassdoor.com/sql/2990/state-farm-squarelogo-1471966649632.png,0.22887574262210608,Insurance Carriers,-0.3338978995341319,-0.20522335957956087,1.8227563344677669,"Being a good neighbor is about more than just being there when things go completely wrong. It's also about being there for all of life's moments when things go perfectly right.

With a passion for serving customers and giving back in our communities, we've been doing well by doing good for almost 100 years. And we're happy you decided to get to know us better.",-0.1752378908071708
Lockheed Martin,0.9257843365625038,https://media.glassdoor.com/sql/404/lockheed-martin-squarelogo-1497984580535.png,0.22887574262210608,Aerospace & Defense,-0.4620010568689616,-0.1462829754420718,0.0023172659191486966,"At Lockheed Martin, we don’t just think big thoughts. We get things done.

And we're bringing together the best minds in the industry to do it.

From our Advanced Development Programs, also known as the Skunk Works® to advances in renewable energy, we're always adapting, always innovating, and always figuring out ways to meet the needs of the real challenges our customers face. 

If you're ready to solve problems that don't have quick answers,  check us out.",-0.18540032209667048
Fidelity Investments,1.7798024454845038,https://media.glassdoor.com/sql/2786/fidelity-investments-squareLogo-1612542116323.png,0.22887574262210608,Investment & Asset Management,-0.3901383100713742,-0.17759505451511287,-0.33427820267371827,"Building a better financial future— for everyone— is our mission. 
From our origins in democratizing investing, and through the last 75+ years, our privately-held company has remained committed to supporting our clients throughout their lifelong financial journeys.

Whether we’re assisting companies and non-profit organizations to deliver benefits to their employees or providing institutions and independent advisors with cutting edge investment and technology solutions, we’re committed to helping people invest and plan for their futures.

",-0.2192750930616694
PepsiCo,0.49877528210150573,https://media.glassdoor.com/sql/522/pepsico-squareLogo-1684858464866.png,0.22887574262210608,Food & Beverage Manufacturing,-0.25578621823240644,-0.34152299789750434,-0.09056227839455631,"PepsiCo is a playground for curious people. We invite thinkers, doers, and changemakers to champion innovation, take calculated risks, and challenge the status quo. From executives to team members on the front lines, we’re excited about the future. We take chances. Together, we dare to make the world a better place. 

Our associates are the magic ingredient. Each of them plays an integral role in helping create deep connections between people and our products. Think about your last group celebration: Chances are, one of our iconic brands was by your side. At PepsiCo, you’re invited to be a part of a global team of innovators who make, move, and sell these products—which are enjoyed by more than 1 billion people a day. 

A career at PepsiCo means working in a culture where everyone’s welcome. Here, you can dare to be yourself. No matter who you are or where you’re from, you can influence the people around you and the world at large. By showing up, you’ll have the opportunity to learn, develop and grow your skills for the future. Our supportive teams can fuel your professional goals to make a global impact on people and the planet.  

Join us. Dare for Better. 

PepsiCo is an Equal Opportunity Employer: Race/Color/National Origin/Age/Religion/Sex/Sexual Orientation/Gender Identity/Disability/Protected Veteran",-0.18540032209667048
UnitedHealth Group,-0.7822518812814923,https://media.glassdoor.com/sql/1991/unitedhealth-group-squareLogo-1689785538947.png,0.22887574262210608,Health Care Services & Hospitals,-0.36514257205482203,-0.31942035384594597,-0.36372101822116276,"UnitedHealth Group is a health care and well-being company that’s dedicated to improving the health outcomes of millions worldwide. We are comprised of two distinct and complementary businesses, UnitedHealthcare and Optum, working to build a better health system for all. Here, your contributions matter as they will help transform health care for years to come. Make an impact with a diverse team that shares your passion for helping others.

Caring. Connecting. Growing together. 

Being a part of UnitedHealth Group means working to improve health outcomes for everyone, including yourself. 

Here is how:

Caring. Your total health and well-being are important to us. Whatever matters most to you — we have resources to help you be your best at work and at home. The benefits range from free Peloton courses to financial counseling. 

Connecting. We recognize our collective power to make an impact across our communities because we believe the health of any society is measured by the overall health of its people. 

Growing together. UnitedHealth Group is full of inspiring career stories, and we offer a lifetime of opportunities. ",-0.18540032209667048
YMCA,0.07176622764050578,https://media.glassdoor.com/sql/3046/ymca-squareLogo-1684940149454.png,-4.079662135596275,Civic & Social Services,-0.2651596199886135,-0.25311242169127074,0.8103693014483823,"The YMCA was established over 160 years ago as a charity dedicated to the health of both individuals and communities.

Our focus on inclusiveness and accessibility means we serve people of all ages, backgrounds and abilities through all stages of life. Through YMCA financial assistance programs, the YMCA is accessible to all.",-0.16846293661417103
Kaiser Permanente,0.07176622764050578,https://media.glassdoor.com/sql/19466/kaiser-permanente-squarelogo-1500927016465.png,0.22887574262210608,Health Care Services & Hospitals,-0.42450744984413336,-0.23100977763971234,0.058044992507371704,"At Kaiser Permanente, we work as one for a healthier today and tomorrow. Founded in 1945, our unique business model sets us apart — positioning all of us to help deliver total health.

As the nation’s leading not-for-profit health plan, we proudly serve 12.5 million members from more than 600 locations in California, Oregon, Washington, Colorado, Georgia, Maryland, Virginia, Hawaii and Washington D.C. Together, our 217,000+ employees make up an integrated health care delivery system with a mission to improve the lives of our members, employees, and communities.

Join us at the heart of health care and experience an environment where you can play a role in shaping the delivery of care with colleagues just as passionate as you. You’ll be part of a community that’s focused on reaching outside the walls of our facilities to help build every community.

When you join Kaiser Permanente, you stand for total health.
",-0.18540032209667048
Publix,-0.3552428268204942,https://media.glassdoor.com/sql/2945/publix-squarelogo-1596222086959.png,0.22887574262210608,Grocery Stores,-0.33077343228206285,-0.23100977763971234,-0.34672406161175473,"Publix Super Markets tops the list of privately-owned supermarkets in the US.  The nation's largest employee-owned company, Publix has grown faster and been more profitable than its rivals. More than two-thirds of its 1,200-plus stores are in Florida, but Publix is gaining an increasing presence in Alabama, Georgia, North and South Carolina, Tennessee and Virginia. Publix's manufacturing operations produce award-winning bakery and dairy products as well as deli goods. More than 950 store locations have pharmacies and some have liquor stores, too. Founder George Jenkins began offering stock to Publix employees in 1930.",-0.26331229531616795
Honeywell,0.49877528210150573,https://media.glassdoor.com/sql/28/honeywell-squarelogo-1495480258685.png,0.22887574262210608,Computer Hardware Development,-0.2120436767034402,-0.38020262498773155,-0.10913818725729732,"Honeywell (www.honeywell.com) delivers industry specific solutions that include aerospace products and services; control technologies for buildings and industry; and performance materials globally. Our technologies help aircraft, buildings, manufacturing plants, supply chains, and workers become more connected to make our world smarter, safer, and more sustainable. For more news and information on Honeywell, please visit www.honeywell.com/newsroom.
",-0.18540032209667048
Walt Disney Company,0.07176622764050578,https://media.glassdoor.com/sql/717/walt-disney-company-squarelogo-1574088286127.png,0.22887574262210608,Film Production,-0.4151340480879263,-0.28626638776860835,-0.27632136702196636,"The monarch of this magic kingdom is no man but a mouse -- Mickey Mouse. The Walt Disney Company is the world's largest media conglomerate, with assets encompassing movies, television, publishing, and theme parks. Its Disney/ABC Television Group includes the ABC television network and 10 broadcast stations, as well as a portfolio of cable networks including ABC Family, Disney Channel, and ESPN (80%-owned). Walt Disney Studios produces films through imprints Walt Disney Pictures, Disney Animation, and Pixar, and its Marvel Entertainment is a top comic book publisher and film producer. In addition, Walt Disney Parks and Resorts operates the company's popular theme parks including Walt Disney World and Disneyland.",-0.18540032209667048
Marriott International,0.49877528210150573,https://media.glassdoor.com/sql/7790/marriott-squarelogo-1484689562079.png,0.22887574262210608,Hotels & Resorts,-0.32764896502999385,-0.3323135628760217,4.200472668898615,"Marriott International is the world’s largest hotel company, with more brands, more hotels and more opportunities for associates to grow and succeed. With 7,200 properties, you’ll find us in your neighborhood and in more than 134 countries and territories across the globe. Learn about our 30 hotel brands at www.marriott.com.  Find Your World.™",-0.1447505969386718
